{
  "$schema": "https://json-schema.org/draft/2020-12/schema",
  "$id": "actions",
  "type": "array",
  "items": {
    "type": "object",
    "additionalProperties": false,
    "required": [
      "puid",
      "signature"
    ],
    "dependencies": {
      "operator": [
        "bof",
        "eof"
      ],
      "plain_bof": [
        "bof"
      ],
      "plain_eof": [
        "eof"
      ]
    },
    "if": {
      "required": [
        "bof",
        "eof"
      ]
    },
    "then": {
      "required": [
        "operator"
      ]
    },
    "else": {
      "oneOf": [
        {
          "required": [
            "bof"
          ]
        },
        {
          "required": [
            "eof"
          ]
        }
      ]
    },
    "properties": {
      "bof": {
        "type": "string"
      },
      "plain_bof": {
        "type": "string"
      },
      "eof": {
        "type": "string"
      },
      "plain_eof": {
        "type": "string"
      },
      "operator": {
        "type": "string",
        "enum": [
          "AND",
          "OR",
          "XOR"
        ]
      },
      "puid": {
        "type": "string"
      },
      "signature": {
        "type": "string"
      },
      "extension": {
        "oneOf": [
          {
            "type": "string",
            "pattern": "^(\\.\\w+)+$"
          },
          {
            "type": "array",
            "items": {
              "type": "string",
              "pattern": "^(\\.\\w+)+$"
            }
          }
        ]
      },
      "extension_required": {
        "type": "boolean"
      },
      "description": {
        "type": "string"
      }
    }
  }
}
